,Title,Content,Link,Topic
0,Artificial intelligence,"Artificial intelligence (AI) is the intelligence of machines or software, as opposed to the intelligence of living beings, primarily of humans. It is a field of study in computer science that develops and studies intelligent machines. Such machines may be called AIs.
AI technology is widely used throughout industry, government, and science. Some high-profile applications are: advanced web search engines (e.g., Google Search), recommendation systems (used by YouTube, Amazon, and Netflix), interacting via human speech (e.g., Google Assistant, Siri, and Alexa), self-driving cars (e.g., Waymo), generative and creative tools (e.g., ChatGPT and AI art), and superhuman play and analysis in strategy games (e.g., chess and Go).Alan Turing was the first person to conduct substantial research in the field that he called machine intelligence. Artificial intelligence was founded as an academic discipline in 1956. The field went through multiple cycles of optimism, followed by periods of disappointment and loss of funding, known as AI winter. Funding and interest vastly increased after 2012 when deep learning surpassed all previous AI techniques, and after 2017 with the transformer architecture. This led to the AI spring of the early 2020s, with companies, universities, and laboratories overwhelmingly based in the United States pioneering significant advances in artificial intelligence.The growing use of artificial intelligence in the 21st century is influencing a societal and economic shift towards increased automation, data-driven decision-making, and the integration of AI systems into various economic sectors and areas of life, impacting job markets, healthcare, government, industry, and education. This raises questions about the ethical implications and risks of AI, prompting discussions about regulatory policies to ensure the safety and benefits of the technology.
The various sub-fields of AI research are centered around particular goals and the use of particular tools. The traditional goals of AI research include reasoning, knowledge representation, planning, learning, natural language processing, perception, and support for robotics. General intelligence (the ability to complete any task performable by a human) is among the field's long-term goals.To solve these problems, AI researchers have adapted and integrated a wide range of problem-solving techniques, including search and mathematical optimization, formal logic, artificial neural networks, and methods based on statistics, operations research, and economics. AI also draws upon psychology, linguistics, philosophy, neuroscience and other fields.",https://en.wikipedia.org/wiki/Artificial_intelligence,Artificial Intelligence
1,Artificial general intelligence,"An artificial general intelligence (AGI) is a type of artificial intelligence (AI) that can perform as well or better than humans on a wide range of cognitive tasks, as opposed to narrow AI, which is designed for specific tasks.Creating AGI is a primary goal of some artificial intelligence research and of companies such as OpenAI, DeepMind, and Anthropic. A 2020 survey identified 72 active AGI R&D projects spread across 37 countries.The timeline for AGI development remains a subject of ongoing debate among researchers and experts. As of 2023, some argue that it may be possible in years or decades; others maintain it might take a century or longer; and a minority believe it may never be achieved. There is debate on the exact definition of AGI, and regarding whether modern large language models (LLMs) such as GPT-4 are early, incomplete forms of AGI. AGI is a common topic in science fiction and futures studies.
Contention exists over the potential for AGI to pose a threat to humanity; for example, OpenAI claims to treat it as an existential risk, while others find the development of AGI to be too remote to present a risk.",https://en.wikipedia.org/wiki/Artificial_general_intelligence,Artificial Intelligence
2,Generative artificial intelligence,"Generative artificial intelligence (generative AI, GenAI, or GAI) is artificial intelligence capable of generating text, images or other data using generative models, often in response to prompts. Generative AI models learn the patterns and structure of their input training data and then generate new data that has similar characteristics.Improvements in transformer-based deep neural networks enabled an AI boom of generative AI systems in the early 2020s. These include large language model (LLM) chatbots such as ChatGPT, Copilot, Gemini and LLaMA, text-to-image artificial intelligence image generation systems such as Stable Diffusion, Midjourney and DALL-E, and text-to-video AI generators such as Sora.  Companies such as OpenAI, Anthropic, Microsoft, Google, and Baidu as well as numerous smaller firms have developed generative AI models.Generative AI has uses across a wide range of industries, including
software development, healthcare, finance, entertainment, customer service, sales and marketing, art, writing, fashion, and product design. However, concerns have been raised about the potential misuse of generative AI such as cybercrime, the use of fake news or deepfakes to deceive or manipulate people, and the mass replacement of human jobs.",https://en.wikipedia.org/wiki/Generative_artificial_intelligence,Artificial Intelligence
3,Hallucination (artificial intelligence),"In the field of artificial intelligence (AI), a hallucination or artificial hallucination (also called confabulation or delusion) is a response generated by an AI which contains false or misleading information presented as fact.For example, a hallucinating chatbot might, when asked to generate a financial report for a company, falsely state that the company's revenue was $13.6 billion (or some other number apparently ""plucked from thin air"").
Such phenomena are termed ""hallucinations"", in loose analogy with the phenomenon of hallucination in human psychology. However, one key difference is that human hallucination is usually associated with false percepts, but an AI hallucination is associated with the category of unjustified responses or beliefs. Some researchers believe the specific term ""AI hallucination"" unreasonably anthropomorphizes computers.AI hallucination gained prominence during the AI boom, alongside the rollout of widely used chatbots based on large language models (LLMs), such as ChatGPT. Users complained that such chatbots often seemed to pointlessly embed plausible-sounding random falsehoods within their generated content. By 2023, analysts considered frequent hallucination to be a major problem in LLM technology, with some estimating chatbots hallucinate as much as 27% of the time and a study finding factual errors in 46% of generated responses.",https://en.wikipedia.org/wiki/Hallucination_(artificial_intelligence),Artificial Intelligence
4,A.I. Artificial Intelligence,"A.I. Artificial Intelligence (or simply A.I.) is a 2001 American science fiction film directed by Steven Spielberg. The screenplay by Spielberg and screen story by Ian Watson were loosely based on the 1969 short story ""Supertoys Last All Summer Long"" by Brian Aldiss. Set in a futuristic society, the film stars Haley Joel Osment as David, a childlike android uniquely programmed with the ability to love. Jude Law, Frances O'Connor, Brendan Gleeson and William Hurt star in supporting roles.
Development of A.I. originally began after producer/director Stanley Kubrick acquired the rights to Aldiss' story in the early 1970s. Kubrick hired a series of writers, including Brian Aldiss, Bob Shaw, Ian Watson and Sara Maitland, until the mid-1990s. The film languished in development hell for years, partly because Kubrick felt that computer-generated imagery was not advanced enough to create the David character, whom he believed no child actor would convincingly portray. In 1995, Kubrick handed A.I. to Spielberg, but the film did not gain momentum until Kubrick died in 1999. Spielberg remained close to Watson's treatment for the screenplay, and dedicated the film to Kubrick.
A.I. Artificial Intelligence was released on June 29, 2001, by Warner Bros. Pictures in North America. It received generally positive reviews from critics and grossed $235.9 million against a budget of $90–100 million. It was also nominated for Best Visual Effects and Best Original Score (for John Williams) at the 74th Academy Awards. In a 2016 BBC poll of 177 critics around the world, A.I. Artificial Intelligence was voted the eighty-third greatest film since 2000. It has since been called one of Spielberg's best works and one of the greatest films of the 21st century, and of all time.

",https://en.wikipedia.org/wiki/A.I._Artificial_Intelligence,Artificial Intelligence
5,Artificial intelligence art,"Artificial intelligence art is any visual artwork created through the use of artificial intelligence (AI) programs such as text-to-image models.Artists began to create AI art in the mid- to late 20th century, when the discipline was founded. In the early 21st century, the availability of AI art tools to the general public increased, providing opportunities for use outside of academia and professional artists. Throughout its history, artificial intelligence art has raised many philosophical concerns, including those related to copyright, deception, and its impact on traditional artists, including their incomes. 

",https://en.wikipedia.org/wiki/Artificial_intelligence_art,Artificial Intelligence
6,Applications of artificial intelligence,"Artificial intelligence (AI) has been used in applications throughout industry and academia. Similar to electricity or computers, AI serves as a general-purpose technology that has numerous applications. Its applications span language translation, image recognition, credit scoring, e-commerce and various other domains.",https://en.wikipedia.org/wiki/Applications_of_artificial_intelligence,Artificial Intelligence
7,History of artificial intelligence,"The history of artificial intelligence (AI) began in antiquity, with myths, stories and rumors of artificial beings endowed with intelligence or consciousness by master craftsmen. The seeds of modern AI were planted by philosophers who attempted to describe the process of human thinking as the mechanical manipulation of symbols. This work culminated in the invention of the programmable digital computer in the 1940s, a machine based on the abstract essence of mathematical reasoning. This device and the ideas behind it inspired a handful of scientists to begin seriously discussing the possibility of building an electronic brain.
The field of AI research was founded at a workshop held on the campus of Dartmouth College, USA during the summer of 1956. Those who attended would become the leaders of AI research for decades. Many of them predicted that a machine as intelligent as a human being would exist in no more than a generation, and they were given millions of dollars to make this vision come true.Eventually, it became obvious that researchers had grossly underestimated the difficulty of the project. In 1974, in response to the criticism from James Lighthill and ongoing pressure from congress, the U.S. and British Governments stopped funding undirected research into artificial intelligence, and the difficult years that followed would later be known as an ""AI winter"". Seven years later, a visionary initiative by the Japanese Government inspired governments and industry to provide AI with billions of dollars, but by the late 1980s the investors became disillusioned and withdrew funding again.
Investment and interest in AI boomed in the 2020s when machine learning was successfully applied to many problems in academia and industry due to new methods, the application of powerful computer hardware, and the collection of immense data sets.",https://en.wikipedia.org/wiki/History_of_artificial_intelligence,Artificial Intelligence
8,Explainable artificial intelligence,"Explainable AI (XAI), often overlapping with Interpretable AI, or Explainable Machine Learning (XML), either refers to an AI system over which it is possible for humans to retain intellectual oversight, or to the methods to achieve this. The main focus is usually on the reasoning behind the decisions or predictions made by the AI which are made more understandable and transparent. XAI counters the ""black box"" tendency of machine learning, where even the AI's designers cannot explain why it arrived at a specific decision.XAI hopes to help users of AI-powered systems perform more effectively by improving their understanding of how those systems reason. XAI may be an implementation of the social right to explanation. Even if there is no such legal right or regulatory requirement, XAI can improve the user experience of a product or service by helping end users trust that the AI is making good decisions. XAI aims to explain what has been done, what is being done, and what will be done next, and to unveil which information these actions are based on. This makes it possible to confirm existing knowledge, challenge existing knowledge, and generate new assumptions.Machine learning (ML) algorithms used in AI can be categorized as white-box or black-box. White-box models provide results that are understandable to experts in the domain. Black-box models, on the other hand, are extremely hard to explain and can hardly be understood even by domain experts. XAI algorithms follow the three principles of transparency, interpretability, and explainability. A model is transparent “if the processes that extract model parameters from training data and generate labels from testing data can be described and motivated by the approach designer.” Interpretability describes the possibility of comprehending the ML model and presenting the underlying basis for decision-making in a way that is understandable to humans. Explainability is a concept that is recognized as important, but a consensus definition is not available. One possibility is “the collection of features of the interpretable domain that have contributed, for a given example, to producing a decision (e.g., classification or regression)”. If algorithms fulfill these principles, they provide a basis for justifying decisions, tracking them and thereby verifying them, improving the algorithms, and exploring new facts.Sometimes it is also possible to achieve a high-accuracy result with white-box ML algorithms. These algorithms have an interpretable structure that can be used to explain predictions. Concept Bottleneck Models, which use concept-level abstractions to explain model reasoning, are examples of this and can be applied in both image and text prediction tasks. This is especially important in domains like medicine, defense, finance, and law, where it is crucial to understand decisions and build trust in the algorithms. Many researchers argue that, at least for supervised machine learning, the way forward is symbolic regression, where the algorithm searches the space of mathematical expressions to find the model that best fits a given dataset.AI systems optimize behavior to satisfy a mathematically specified goal system chosen by the system designers, such as the command ""maximize the accuracy of assessing how positive film reviews are in the test dataset."" The AI may learn useful general rules from the test set, such as ""reviews containing the word ""horrible"" are likely to be negative."" However, it may also learn inappropriate rules, such as ""reviews containing 'Daniel Day-Lewis' are usually positive""; such rules may be undesirable if they are likely to fail to generalize outside the training set, or if people consider the rule to be ""cheating"" or ""unfair."" A human can audit rules in an XAI to get an idea of how likely the system is to generalize to future real-world data outside the test set.

",https://en.wikipedia.org/wiki/Explainable_artificial_intelligence,Artificial Intelligence
9,Ethics of artificial intelligence,"The ethics of artificial intelligence is the branch of the ethics of technology specific to artificial intelligence (AI) systems.
The ethics of artificial intelligence covers a broad range of topics within the field that are considered to have particular ethical stakes. This includes algorithmic biases, fairness, automated decision-making, accountability, privacy, and regulation. It also covers various emerging or potential future challenges such as machine ethics (how to make machines that behave ethically), lethal autonomous weapon systems, arms race dynamics, AI safety and alignment, technological unemployment, AI-enabled misinformation, how to treat certain AI systems if they have a moral status (AI welfare and rights), artificial superintelligence and existential risks. Some application areas may also have particularly important ethical implications, like healthcare, education, or the military.",https://en.wikipedia.org/wiki/Ethics_of_artificial_intelligence,Artificial Intelligence
10,Machine learning,"Machine learning (ML) is a field of study in artificial intelligence concerned with the development and study of statistical algorithms that can learn from data and generalize to unseen data, and thus perform tasks without explicit instructions. Recently, artificial neural networks have been able to surpass many previous approaches in performance.Machine learning approaches have been applied to many fields including natural language processing, computer vision, speech recognition, email filtering, agriculture, and medicine. ML is known in its application across business problems under the name predictive analytics. Although not all machine learning is statistically based, computational statistics is an important source of the field's methods.
The mathematical foundations of ML are provided by mathematical optimization (mathematical programming) methods. Data mining is a related (parallel) field of study, focusing on exploratory data analysis (EDA) through unsupervised learning.From a theoretical viewpoint, probably approximately correct (PAC) learning provides a framework for describing machine learning.",https://en.wikipedia.org/wiki/Machine_learning,Machine Learning
11,Quantum machine learning,"Quantum machine learning is the integration of quantum algorithms within machine learning programs.The most common use of the term refers to machine learning algorithms for the analysis of classical data executed on a quantum computer, i.e. quantum-enhanced machine learning. While machine learning algorithms are used to compute immense quantities of data, quantum machine learning utilizes qubits and quantum operations or specialized quantum systems to improve computational speed and data storage done by algorithms in a program. This includes hybrid methods that involve both classical and quantum processing, where computationally difficult subroutines are outsourced to a quantum device. These routines can be more complex in nature and executed faster on a quantum computer. Furthermore, quantum algorithms can be used to analyze quantum states instead of classical data.Beyond quantum computing, the term ""quantum machine learning"" is also associated with classical machine learning methods applied to data generated from quantum experiments (i.e. machine learning of quantum systems), such as learning the phase transitions of a quantum system or creating new quantum experiments.Quantum machine learning also extends to a branch of research that explores methodological and structural similarities between certain physical systems and learning systems, in particular neural networks. For example, some mathematical and numerical techniques from quantum physics are applicable to classical deep learning and vice versa.Furthermore, researchers investigate more abstract notions of learning theory with respect to quantum information, sometimes referred to as ""quantum learning theory"".",https://en.wikipedia.org/wiki/Quantum_machine_learning,Machine Learning
12,Neural network (machine learning),"In machine learning, a neural network (also artificial neural network or neural net, abbreviated ANN or NN) is a model inspired by the neuronal organization found in the biological neural networks in animal brains.An ANN is made of connected units or nodes called artificial neurons, which loosely model the neurons in a brain. These are connected by edges, which model the synapses in a brain. An artificial neuron receives signals from connected neurons, then processes them and sends a signal to other connected neurons. The ""signal"" is a real number, and the output of each neuron is computed by some non-linear function of the sum of its inputs, called the activation function. Neurons and edges typically have a weight that adjusts as learning proceeds. The weight increases or decreases the strength of the signal at a connection.
Typically, neurons are aggregated into layers. Different layers may perform different transformations on their inputs. Signals travel from the first layer (the input layer) to the last layer (the output layer), possibly passing through multiple intermediate layers (hidden layers). A network is typically called a deep neural network if it has at least 2 hidden layers.Artificial neural networks are used for predictive modeling, adaptive control, and other applications where they can be trained via a dataset. They are also used to solve problems in artificial intelligence. Networks can learn from experience, and can derive conclusions from a complex and seemingly unrelated set of information.",https://en.wikipedia.org/wiki/Neural_network_(machine_learning),Machine Learning
13,Transformer (deep learning architecture),"A transformer is a deep learning architecture developed by Google and based on the multi-head attention mechanism, proposed in a 2017 paper ""Attention Is All You Need"". It has no recurrent units, and thus requires less training time than previous recurrent neural architectures, such as long short-term memory (LSTM), and its later variation has been prevalently adopted for training large language models (LLM) on large (language) datasets, such as the Wikipedia corpus and Common Crawl.
Text is converted to numerical representations called tokens, and each token is converted into a vector via looking up from a word embedding table. At each layer, each token is then contextualized within the scope of the context window with other (unmasked) tokens via a parallel multi-head attention mechanism allowing the signal for key tokens to be amplified and less important tokens to be diminished. The transformer paper, published in 2017, is based on the softmax-based attention mechanism  proposed by Bahdanau et. al. in 2014 for machine translation, and the Fast Weight Controller, similar to a transformer, proposed in 1992.
This architecture is now used not only in natural language processing and computer vision, but also in audio and multi-modal processing. It has also led to the development of pre-trained systems, such as generative pre-trained transformers (GPTs) and BERT (Bidirectional Encoder Representations from Transformers).",https://en.wikipedia.org/wiki/Transformer_(deep_learning_architecture),Machine Learning
14,Boosting (machine learning),"In machine learning, boosting is an ensemble meta-algorithm for primarily reducing bias, variance in supervised learning, and a family of machine learning algorithms that convert weak learners to strong ones. Boosting is based on the question posed by Kearns and Valiant (1988, 1989): ""Can a set of weak learners create a single strong learner?"" A weak learner is defined to be a classifier that is only slightly correlated with the true classification (it can label examples better than random guessing). In contrast, a strong learner is a classifier that is arbitrarily well-correlated with the true classification.
Robert Schapire's affirmative answer in a 1990 paper to the question of Kearns and Valiant has had significant ramifications in machine learning and statistics, most notably leading to the development of boosting.When first introduced, the hypothesis boosting problem simply referred to the process of turning a weak learner into a strong learner. ""Informally, [the hypothesis boosting] problem asks whether an efficient learning algorithm […] that outputs a hypothesis whose performance is only slightly better than random guessing [i.e. a weak learner] implies the existence of an efficient algorithm that outputs a hypothesis of arbitrary accuracy [i.e. a strong learner]."" Algorithms that achieve hypothesis boosting quickly became simply known as ""boosting"". Freund and Schapire's arcing (Adapt[at]ive Resampling and Combining), as a general technique, is more or less synonymous with boosting.",https://en.wikipedia.org/wiki/Boosting_(machine_learning),Machine Learning
15,Adversarial machine learning,"Adversarial machine learning is the study of the attacks on machine learning algorithms, and of the defenses against such attacks. A survey from May 2020 exposes the fact that practitioners report a dire need for better protecting machine learning systems in industrial applications.Most machine learning techniques are mostly designed to work on specific problem sets, under the assumption that the training and test data are generated from the same statistical distribution (IID). However, this assumption is often dangerously violated in practical high-stake applications, where users may intentionally supply fabricated data that violates the statistical assumption.
Most common attacks in adversarial machine learning include evasion attacks, data poisoning attacks, Byzantine attacks and model extraction.",https://en.wikipedia.org/wiki/Adversarial_machine_learning,Machine Learning
