,Title,Content,Link,Topic
16,Attention (machine learning),"Machine learning-based attention is a mechanism which intuitively mimics cognitive attention. It calculates ""soft"" weights for each word, more precisely for its embedding, in the context window. These weights can be computed either in parallel (such as in transformers) or sequentially (such as recurrent neural networks). ""Soft"" weights can change during each runtime, in contrast to ""hard"" weights, which are (pre-)trained and fine-tuned and remain frozen afterwards.  
Attention was developed to address the weaknesses of leveraging information from the hidden outputs of recurrent neural networks.  Recurrent neural networks favor more recent information contained in words at the end of a sentence, while information earlier in the sentence is expected to be attenuated.  Attention allows the calculation of the hidden representation of a token equal access to any part of a sentence directly, rather than only through the previous hidden state.  
Earlier uses attached this mechanism to a serial recurrent neural network's language translation system (below), but later uses in Transformers large language models removed the recurrent neural network and relied heavily on the faster parallel attention scheme.",https://en.wikipedia.org/wiki/Attention_(machine_learning),Machine Learning
17,Artificial intelligence,"Artificial intelligence (AI) is the intelligence of machines or software, as opposed to the intelligence of living beings, primarily of humans. It is a field of study in computer science that develops and studies intelligent machines. Such machines may be called AIs.
AI technology is widely used throughout industry, government, and science. Some high-profile applications are: advanced web search engines (e.g., Google Search), recommendation systems (used by YouTube, Amazon, and Netflix), interacting via human speech (e.g., Google Assistant, Siri, and Alexa), self-driving cars (e.g., Waymo), generative and creative tools (e.g., ChatGPT and AI art), and superhuman play and analysis in strategy games (e.g., chess and Go).Alan Turing was the first person to conduct substantial research in the field that he called machine intelligence. Artificial intelligence was founded as an academic discipline in 1956. The field went through multiple cycles of optimism, followed by periods of disappointment and loss of funding, known as AI winter. Funding and interest vastly increased after 2012 when deep learning surpassed all previous AI techniques, and after 2017 with the transformer architecture. This led to the AI spring of the early 2020s, with companies, universities, and laboratories overwhelmingly based in the United States pioneering significant advances in artificial intelligence.The growing use of artificial intelligence in the 21st century is influencing a societal and economic shift towards increased automation, data-driven decision-making, and the integration of AI systems into various economic sectors and areas of life, impacting job markets, healthcare, government, industry, and education. This raises questions about the ethical implications and risks of AI, prompting discussions about regulatory policies to ensure the safety and benefits of the technology.
The various sub-fields of AI research are centered around particular goals and the use of particular tools. The traditional goals of AI research include reasoning, knowledge representation, planning, learning, natural language processing, perception, and support for robotics. General intelligence (the ability to complete any task performable by a human) is among the field's long-term goals.To solve these problems, AI researchers have adapted and integrated a wide range of problem-solving techniques, including search and mathematical optimization, formal logic, artificial neural networks, and methods based on statistics, operations research, and economics. AI also draws upon psychology, linguistics, philosophy, neuroscience and other fields.",https://en.wikipedia.org/wiki/Artificial_intelligence,Machine Learning
18,Active learning (machine learning),"Active learning is a special case of machine learning in which a learning algorithm can interactively query a human user (or some other information source), to label new data points with the desired outputs. The human user must possess knowledge/expertise in the problem domain, including the ability to consult/research authoritative sources when necessary.  In statistics literature, it is sometimes also called optimal experimental design. The information source is also called teacher or oracle.
There are situations in which unlabeled data is abundant but manual labeling is expensive. In such a scenario, learning algorithms can actively query the user/teacher for labels. This type of iterative supervised learning is called active learning. Since the learner chooses the examples, the number of examples to learn a concept can often be much lower than the number required in normal supervised learning. With this approach, there is a risk that the algorithm is overwhelmed by uninformative examples.  Recent developments are dedicated to multi-label active learning, hybrid active learning and active learning in a single-pass (on-line) context, combining concepts from the field of machine learning (e.g. conflict and ignorance) with adaptive, incremental learning policies in the field of online machine learning. Using active learning allows for faster development of a machine learning algorithm, when comparative updates would require a quantum or super computer.Large-scale active learning projects may benefit from crowdsourcing frameworks such as Amazon Mechanical Turk that include many humans in the active learning loop.",https://en.wikipedia.org/wiki/Active_learning_(machine_learning),Machine Learning
19,Feature (machine learning),"In machine learning and pattern recognition, a feature is an individual measurable property or characteristic of a phenomenon. Choosing informative, discriminating and independent features is a crucial element of effective algorithms in pattern recognition,  classification and regression. Features are usually numeric, but structural features such as strings and graphs are used in syntactic pattern recognition. The concept of ""feature"" is related to that of explanatory variable used in statistical techniques such as linear regression.

",https://en.wikipedia.org/wiki/Feature_(machine_learning),Machine Learning
20,Data science,"Data science is an interdisciplinary academic field that uses statistics, scientific computing, scientific methods, processes, algorithms and systems to extract or extrapolate knowledge and insights from potentially noisy, structured, or unstructured data.Data science also integrates domain knowledge from the underlying application domain (e.g., natural sciences, information technology, and medicine). Data science is multifaceted and can be described as a science, a research paradigm, a research method, a discipline, a workflow, and a profession.Data science is a ""concept to unify statistics, data analysis, informatics, and their related methods"" to ""understand and analyze actual phenomena"" with data. It uses techniques and theories drawn from many fields within the context of mathematics, statistics, computer science, information science, and domain knowledge. However, data science is different from computer science and information science. Turing Award winner Jim Gray imagined data science as a ""fourth paradigm"" of science (empirical, theoretical, computational, and now data-driven) and asserted that ""everything about science is changing because of the impact of information technology"" and the data deluge.A  data scientist is a professional who creates programming code and combines it with statistical knowledge to create insights from data.",https://en.wikipedia.org/wiki/Data_science,Data Science
21,Data,"In common usage, data (US: ; UK: ) is a collection of discrete or continuous values that convey information, describing the quantity, quality, fact, statistics, other basic units of meaning, or simply sequences of symbols that may be further interpreted formally.  A datum is an individual value in a collection of data. Data is usually organized into structures such as tables that provide additional context and meaning, and which may themselves be used as data in larger structures. Data may be used as variables in a computational process. Data may represent abstract ideas or concrete measurements.
Data is commonly used in scientific research, economics, and in virtually every other form of human organizational activity.  Examples of data sets include price indices (such as consumer price index), unemployment rates, literacy rates, and census data. In this context, data represents the raw facts and figures from which useful information can be extracted. 
Data is collected using techniques such as measurement, observation, query, or analysis, and is typically represented as numbers or characters which may be further processed. Field data is data that is collected in an uncontrolled in-situ environment. Experimental data is data that is generated in the course of a controlled scientific experiment.  Data is analyzed using techniques such as calculation, reasoning, discussion, presentation, visualization, or other forms of post-analysis.  Prior to analysis, raw data (or unprocessed data) is typically cleaned: Outliers are removed and obvious instrument or data entry errors are corrected.
Data can be seen as the smallest units of factual information that can be used as a basis for calculation, reasoning, or discussion. Data can range from abstract ideas to concrete measurements, including, but not limited to, statistics. Thematically connected data presented in some relevant context can be viewed as information. Contextually connected pieces of information can then be described as data insights or intelligence. The stock of insights and intelligence that accumulates over time resulting from the synthesis of data into information, can then be described as knowledge. Data has been described as ""the new oil of the digital economy"". Data, as a general concept, refers to the fact that some existing information or knowledge is represented or coded in some form suitable for better usage or processing.
Advances in computing technologies have led to the advent of big data, which usually refers to very large quantities of data, usually at the petabyte scale. Using traditional data analysis methods and computing, working with such large (and growing) datasets is difficult, even impossible. (Theoretically speaking, infinite data would yield infinite information, which would render extracting insights or intelligence impossible.) In response, the relatively new field of data science uses machine learning (and other artificial intelligence (AI)) methods that allow for efficient applications of analytic methods to big data.

",https://en.wikipedia.org/wiki/Data,Data Science
22,Data (computer science),"In computer science, data (treated as singular, plural, or as a mass noun) is any sequence of one or more symbols; datum is a single symbol of data. Data requires interpretation to become information. Digital data is data that is represented using the binary number system of ones (1) and zeros (0), instead of analog representation. In modern (post-1960) computer systems, all data is digital. 
Data exists in three states: data at rest, data in transit and data in use. Data within a computer, in most cases, moves as parallel data. Data moving to or from a computer, in most cases, moves as serial data. Data sourced from an analog device, such as a temperature sensor, may be converted to digital using an analog-to-digital converter. Data representing quantities, characters, or symbols on which operations are performed by a computer are stored and recorded on magnetic, optical, electronic, or mechanical recording media, and transmitted in the form of digital electrical or optical signals. Data pass in and out of computers via peripheral devices.
Physical computer memory elements consist of an address and a byte/word of data storage. Digital data are often stored in relational databases, like tables or SQL databases, and can generally be represented as abstract key/value pairs. Data can be organized in many different types of data structures, including arrays, graphs, and objects. Data structures can store data of many different types, including numbers, strings and even other data structures.",https://en.wikipedia.org/wiki/Data_(computer_science),Data Science
23,Data type,"In computer science and computer programming, a data type (or simply type) is a collection or grouping of data values, usually specified by a set of possible values, a set of allowed operations on these values, and/or a representation of these values as machine types. A data type specification in a program constrains the possible values that an expression, such as a variable or a function call, might take. On literal data, it tells the compiler or interpreter how the programmer intends to use the data. Most programming languages support basic data types of integer numbers (of varying sizes), floating-point numbers (which approximate real numbers), characters and Booleans.

",https://en.wikipedia.org/wiki/Data_type,Data Science
24,Master in Data Science,"A Master of Science in Data Science is an interdisciplinary degree program designed to provide studies in scientific methods, processes, and systems to extract knowledge or insights from data in various forms, either structured or unstructured, similar to data mining.

",https://en.wikipedia.org/wiki/Master_in_Data_Science,Data Science
25,Data analysis,"Data analysis is the process of inspecting, cleansing, transforming, and modeling data with the goal of discovering useful information, informing conclusions, and supporting decision-making. Data analysis has multiple facets and approaches, encompassing diverse techniques under a variety of names, and is used in different business, science, and social science domains. In today's business world, data analysis plays a role in making decisions more scientific and helping businesses operate more effectively.Data mining is a particular data analysis technique that focuses on statistical modeling and knowledge discovery for predictive rather than purely descriptive purposes, while business intelligence covers data analysis that relies heavily on aggregation, focusing mainly on business information. In statistical applications, data analysis can be divided into descriptive statistics, exploratory data analysis (EDA), and confirmatory data analysis (CDA). EDA focuses on discovering new features in the data while CDA focuses on confirming or falsifying existing hypotheses. Predictive analytics focuses on the application of statistical models for predictive forecasting or classification, while text analytics applies statistical, linguistic, and structural techniques to extract and classify information from textual sources, a species of unstructured data. All of the above are varieties of data analysis.Data integration is a precursor to data analysis, and data analysis is closely linked to data visualization and data dissemination.

",https://en.wikipedia.org/wiki/Data_analysis,Data Science
26,Biomedical data science,"Biomedical data science is a multidisciplinary field which leverages large volumes of data to promote biomedical innovation and discovery. Biomedical data science draws from various fields including Biostatistics, Biomedical informatics, and machine learning, with the goal of understanding biological and medical data. It can be viewed as the study and application of data science to solve biomedical problems. Modern biomedical datasets often have specific features which make their analyses difficult, including:

Large numbers of feature (sometimes billions), typically far larger than the number of samples (typically tens or hundreds)
Noisy and missing data
Privacy concerns (e.g., electronic health record confidentiality)
Requirement of interpretability from decision makers and regulatory bodiesMany biomedical data science projects apply machine learning to such datasets. These characteristics, while also present in many data science applications more generally, make biomedical data science a specific field. Examples of biomedical data science research include: 

Computational genomics
Computational imaging
Electronic health records data mining
Biomedical network science",https://en.wikipedia.org/wiki/Biomedical_data_science,Data Science
27,Big data,"Big data primarily refers to data sets that are too large or complex to be dealt with by traditional data-processing application software. Data with many entries (rows) offer greater statistical power, while data with higher complexity (more attributes or columns) may lead to a higher false discovery rate. Though used sometimes loosely partly due to a lack of formal definition, the best interpretation is that it is a large body of information that cannot be comprehended when used in small amounts only.Big data analysis challenges include capturing data, data storage, data analysis, search, sharing, transfer, visualization, querying, updating, information privacy, and data source. Big data was originally associated with three key concepts: volume, variety, and velocity. The analysis of big data presents challenges in sampling, and thus previously allowing for only observations and sampling. Thus a fourth concept, veracity, refers to the quality or insightfulness of the data. Without sufficient investment in expertise for big data veracity, the volume and variety of data can produce costs and risks that exceed an organization's capacity to create and capture value from big data.Current usage of the term big data tends to refer to the use of predictive analytics, user behavior analytics, or certain other advanced data analytics methods that extract value from big data, and seldom to a particular size of data set. ""There is little doubt that the quantities of data now available are indeed large, but that's not the most relevant characteristic of this new data ecosystem.""
Analysis of data sets can find new correlations to ""spot business trends, prevent diseases, combat crime and so on"". Scientists, business executives, medical practitioners, advertising and governments alike regularly meet difficulties with large data-sets in areas including Internet searches, fintech, healthcare analytics, geographic information systems, urban informatics, and business informatics. Scientists encounter limitations in e-Science work, including meteorology, genomics, connectomics, complex physics simulations, biology, and environmental research.The size and number of available data sets have grown rapidly as data is collected by devices such as mobile devices, cheap and numerous information-sensing Internet of things devices, aerial (remote sensing) equipment, software logs, cameras, microphones, radio-frequency identification (RFID) readers and wireless sensor networks. The world's technological per-capita capacity to store information has roughly doubled every 40 months since the 1980s; as of 2012, every day 2.5 exabytes (2.17×260 bytes) of data are generated. Based on an IDC report prediction, the global data volume was predicted to grow exponentially from 4.4 zettabytes to 44 zettabytes between 2013 and 2020. By 2025, IDC predicts there will be 163 zettabytes of data. According to IDC, global spending on big data and business analytics (BDA) solutions is estimated to reach $215.7 billion in 2021. While Statista report, the global big data market is forecasted to grow to $103 billion by 2027. In 2011 McKinsey & Company reported, if US healthcare were to use big data creatively and effectively to drive efficiency and quality, the sector could create more than $300 billion in value every year. In the developed economies of Europe, government administrators could save more than €100 billion ($149 billion) in operational efficiency improvements alone by using big data. And users of services enabled by personal-location data could capture $600 billion in consumer surplus. One question for large enterprises is determining who should own big-data initiatives that affect the entire organization.Relational database management systems and desktop statistical software packages used to visualize data often have difficulty processing and analyzing big data. The processing and analysis of big data may require ""massively parallel software running on tens, hundreds, or even thousands of servers"". What qualifies as ""big data"" varies depending on the capabilities of those analyzing it and their tools. Furthermore, expanding capabilities make big data a moving target. ""For some organizations, facing hundreds of gigabytes of data for the first time may trigger a need to reconsider data management options. For others, it may take tens or hundreds of terabytes before data size becomes a significant consideration.""

",https://en.wikipedia.org/wiki/Big_data,Data Science
28,Data Science Institute,"The Data Science Institute is a research institute at the Imperial College London founded in May 2014. The institute is one of five Global Institutes at Imperial College London, alongside the Institute of Global Health Innovation, Energy Futures Lab, Institute for Security Science and Technology, and the Grantham Institute - Climate Change and Environment.The Data Science Institute has partnerships with international industry and academia, with formal investments from Chinese multinational telecoms company Huawei, multinational consultancy KPMG, and Zhejiang University, China.The goal of the institute is to enhance multidisciplinary data science research across the whole of Imperial College by coordinating and promoting data-driven research and education activities. These activities cover all areas across the College including engineering, medicine, natural sciences, and business.
The institute houses a custom built large-scale immersive data visualization facility called the KPMG Data Observatory, which has a resolution of 132 megapixels that is thought to be the largest such system in Europe.",https://en.wikipedia.org/wiki/Data_Science_Institute,Data Science
29,Computer science,"Computer science is the study of computation, information, and automation. Computer science spans theoretical disciplines (such as algorithms, theory of computation, and information theory) to applied disciplines (including the design and implementation of hardware and software). Though more often considered an academic discipline, computer science is closely related to computer programming.Algorithms and data structures are central to computer science.
The theory of computation concerns abstract models of computation and general classes of problems that can be solved using them. The fields of cryptography and computer security involve studying the means for secure communication and for preventing security vulnerabilities. Computer graphics and computational geometry address the generation of images. Programming language theory considers different ways to describe computational processes, and database theory concerns the management of repositories of data. Human–computer interaction investigates the interfaces through which humans and computers interact, and software engineering focuses on the design and principles behind developing software. Areas such as operating systems, networks and embedded systems investigate the principles and design behind complex systems. Computer architecture describes the construction of computer components and computer-operated equipment. Artificial intelligence and machine learning aim to synthesize goal-orientated processes such as problem-solving, decision-making, environmental adaptation, planning and learning found in humans and animals. Within artificial intelligence, computer vision aims to understand and process image and video data, while natural language processing aims to understand and process textual and linguistic data.
The fundamental concern of computer science is determining what can and cannot be automated. The Turing Award is generally recognized as the highest distinction in computer science.",https://en.wikipedia.org/wiki/Computer_science,Data Science
